transcription;language;emotion;model_transcription;model_emotion
Non so che cosa mi succede scusami.;italian;fear; Non so che cosa mi succede, scusami.;disgust
Scusa è davvero scortese da parte mia.;italian;fear; Scusa, è davvero scortese da parte mia.;disgust
Non toccarmi Dio.;italian;fear; Non toccarmi, tio!;anger
Una mattina, a Wellfleet, c'eri tu, eravamo tutti lì.;italian;fear; Una mattina. Ah, o un flitto. C'era di tu. Era molto utile.;disgust
Non lo so, io stavo incartando i bicchieri e qualche  altra cosa.;italian;fear; Non lo so, io stavo incartando i bicchieri e qualche altra cosa e...;fear
Ho avuto un’angoscia tremenda.;italian;fear; Ovo, nangosci, a tre mei.;sadness
Non è che hai fatto questo passo solo per me vero?;italian;fear; Non è che hai fatto questo passo solo per me, è vero?;fear
Ti prego rispondimi, cosa è successo, dimmi.;italian;fear; Ti prego, rispondimi. Cosa è successo? Dimmelo.;disgust
Non stò mentendo, sono andata da lui per un aiuto.;italian;fear; Non sto mentendo, sono andata da lui per un aiuto.;disgust
Non te lo posso dire, qualcuno potrebbe farsi del male.;italian;fear; Non te lo posso dire, qualcuno potrebbe farsi del male.;fear
Chiacchiera troppo e  si caccia nei guai.;italian;fear; chiacchierà troppo e si cacciano i guai.;happiness
La notte se ne andava a dormire a Hooverville.;italian;fear; La notte se ne andava a dormire a Overville;sadness
Mio fratello non ha posto per tutti e due.;italian;fear; Mio fratello non ha posto per tutti e due.;sadness
Mike ha detto che sai, se doveva stare là;italian;fear; E Mike ha detto che, sai, se doveva stare là...;anger
Tanto valeva cercare di organizzare la gente.;italian;fear; Tanto valeva cercare di organizzare la gente.;fear
È successo qualcosa Jim, me lo sento.;italian;fear; È successo qualcosa, Jim, me lo sento.;happiness
Ho saputo che ci sono stati dei disordini a Hooverville.;italian;fear; Ho saputo che ci sono stati dei disordini, Hooverfield.;disgust
Non sapevo da chi altro andare Jim.;italian;fear; Non sapevo da chi altro andareci;happiness
No, ma credo che abbiano visto me.;italian;fear; No, ma credo che abbiano visto me.;disgust
Aspetta, hai sentito?;italian;fear; Aspetta, ha sentito!;happiness
Non poteva arrivarci da sola ma è abbastanza alta.;italian;fear; Non poteva arriverci da sola, non è abbastanza alta.;fear
Questo lo sa spiegare?;italian;fear; Questo ve lo sa spiegare!;happiness
Parlare col comandante.;italian;fear; Devo parlare col comandante.;happiness
È sufficiate che voi facciate sgombrare i corridoi, così posso controllare.;italian;fear; E' sufficiente che voi facciate sgombrare i corridoi così posso controllare.;anger
Non restano molti posti da controllare, basta fare evaquare l'aereo allatterraggio.;italian;fear; Non restano molti posti da controllare, basta fare evacuare l'aereo all'atterraggio.;fear
Tesoro non é un buon motivo.;italian;fear; Tesoro, non è un buon motivo!;anger
L'ho vista per caso passare di qui.;italian;fear; L'ha vista per caso passare di qui o...;sadness
L’havuta una brutta esperienza lei.;italian;fear; Ma potrò in un brutto esperienza, lei?;disgust
Non è in se in questo momento.;italian;fear; Non è in sé in questo momento.;disgust
Ha chiuso a chiave un sacco di cose mie importanti, documenti e altre cose che devo riavére perciò non lo faccia salire.;italian;fear; ha chiusa che aveva un sacco di cose mie importanti, documenti, altre cose che dovrei avere, perciò non lo faccio salire!;anger
Allora ci stai con me a ucciderlo.;italian;fear; Allora ci stai con me a ucciderlo.;sadness
La prego abbia pietà di me. Ho una famiglia.;italian;fear; La prego, abbia piacere di me! Ho una famiglia!;happiness
Non capisco. Che vuol dire tenerlo in vita?;italian;fear; Non capisco che vuol dire tenerlo in vita.;fear
Non diga sciocchezze morirebbe.;italian;fear; Non dica a questi ragazzi, morirebbe!;anger
Quatto freddo.;italian;fear; Quanto fredda!;happiness
Io solo continuare a fare la nostra solita vita e dimenticare tuttto;italian;fear; Lo solo continuare a fare la nostra solita vita è dimenticare tutto.;happiness
Io l’ho già vista.;italian;fear; Io l'ho già vista.;fear
Qui al centro commerciale, a casa nostra.;italian;fear; qui al centro commerciale, a casa nostra.;disgust
Ma chi!;italian;fear; Macchie!;happiness
Ma che cosa stai dicendo.;italian;fear; Ma che cosa stai dicendo, Leroy?;disgust
Non hanno detto niente, giusto?;italian;fear; Non hanno detto niente, giusto?;disgust
E perchè, dire che fregna sempre non è criticare? Io credo di sì.;italian;disgust; Perché dire che Friña sempre non è criticare, io credo di sì.;fear
Ma guarda che novità.;italian;disgust; Ma guarda che novità!;anger
Voglio dire Vanessa, che anche i pazzi gradirebbero essere invitati.;italian;disgust; Voglio dire Vanessa che anche i pazzi gradirebbero essere invitati.;fear
Sì un trionfo.;italian;disgust; Sì, un triunfo!;anger
Sei caduto e hai battuto la testa sul pavimento.;italian;disgust; Se cadute, hai battuto la testa sul pavimento.;fear
Qualcun’altro ha un'idea che io possa utilizzare?;italian;disgust; Qualcun altro ha un'idea che io possa utilizzare?;fear
Joid, tesoro caro, io ti voglio tanto bene.;italian;disgust; Lloyd, tesoro caro, io ti voglio tanto bene.;sadness
Ma a volte mi viene da chiedermi se tu sia veramente mio figlio.;italian;disgust; ma a volte mi viene da chiedermi se tu sia veramente mio figlio.;fear
Sei sempre stato più simile a tuo padre.;italian;disgust; Sei sempre stato più simile a tuo padre.;fear
Ti dispiacerebbe dirmi cosa vuoi esattamente?;italian;disgust; Ti dispiacerebbe dirmi cosa vuoi esattamente?;fear
Ora lei mi dà la pistola o mi ridà i miei soldi.;italian;disgust; Ora lei mi dà la pistola o mi ridà i miei soldi.;fear
E io preferirei di gran lunga i miei soldi.;italian;disgust; e io preferirei di gran lunga i miei sciolti.;happiness
Me le da per favore?;italian;disgust; Me le dà per favore?;disgust
Oh sì, ci avrebbero sparato in mezzo al boulievard.;italian;disgust; Ah sì, ci avrebbero sparato in mezzo al boulevard!;happiness
Mio padre è del Puerto Rico, mia madre è del Salvador.;italian;disgust; Mio padre è del Portorico, mia madre è del Salvador.;disgust
Né l'uno né l'altro è il Messico.;italian;disgust; Nell'uno nell'altro è il Messico.;fear
Non lo so. Non è malata?;italian;disgust; Non lo so. Non è malata?;disgust
I malati a volte inventano le cose se non sbaglio.;italian;disgust; malati a volte inventano le cose se non sbaglio.;disgust
Una donna che aveva in cura ha ucciso il marito.;italian;disgust; Una donna che avevi in cura ha ucciso il marito.;sadness
Una benda per gli occhi.;italian;disgust; Una benda per gli occhi.;disgust
Oh smettila mamma. Ti farai venire una emorragia nasale.;italian;disgust; Smetti la mamma, ti farei venire un'emorragia a Nazar.;fear
Me lo ricordi tutti i santi giorni.;italian;disgust; me lo ricordi tutti i santi giorni.;fear
Non era una domanda.;italian;disgust; Non era una domanda?;disgust
Qualcuno ha una sigaretta?;italian;disgust; Qualcuno ha una sigaretta?;fear
E tu puoi fare qualsiasi cosa, giusto?;italian;disgust; e tu puoi fare qualsiasi cosa, giusto?;happiness
Poteva anche salire il tuo amico gli facevo un caffé.;italian;disgust; poteva anche salire il tuo amico e gli faceva un caffè?;fear
Non sarà un novantotto ma sono ancora.;italian;disgust; Non sarà un 98 ma sono ancora qui.;sadness
In Texas non lo bevono il caffè?;italian;disgust; In Texas non lo bevono il caffè?;disgust
Larry, perché non te ne vai adesso.;italian;disgust; Clark, perché non te ne vai adesso?;anger
Certo che lo so.;italian;disgust; Certo che lo so.;disgust
Sono guarita.;italian;happiness; Sono guarita.;disgust
Congratulazioni!;italian;happiness; Congratulazioni!;anger
Bene, grazie Signor Burton.;italian;happiness; Bene, grazie signora Bartonio.;happiness
Sai che sorpresa.;italian;happiness; Sai che sorpresa!;sadness
Fantastica! È veramente grandiosa. Perfetto.;italian;happiness; Fantastico! È veramente grandioso! Perfetto!;happiness
Sei proprio tu!;italian;happiness; Sei proprio tu!;anger
A volte, ma un po' più silenziosamente.;italian;happiness; A volte, ma un po' più silenziosamente.;fear
No, mi serve un lottatore con una laurea.;italian;happiness; No, mi serve un lottatore con una laurea.;sadness
È meraviglioso.;italian;happiness; È meraviglioso!;anger
Al contrario.;italian;happiness; Al contrario.;disgust
Nessuno mi fa ridelle come te.;italian;happiness; Nessuno mi fa ridere come te!;happiness
Ciao papá.;italian;happiness; Ciao, papà!;happiness
Ho ordinato le partecipazioni due settimane fa.;italian;happiness; Ho ordinato le partecipazioni due settimane fa.;disgust
Forse dovresti solo, come dire.;italian;happiness; Forse dovresti solo com'è dire?;fear
Tu e mio figlio portate la stessa taglia.;italian;happiness; Tu e mio figlio portate la stessa taglia!;happiness
Oh, mi scusi io … mi scusi.;italian;happiness; No, mi scusi, mi scusi.;disgust
Ah mio dio Peter, siamo stati bambini in queste stanze.;italian;happiness; Ah, mio Dio, Peter, siamo stati bambini in queste stanze!;happiness
È sempre stato il mio nome preferito.;italian;happiness; Adesso è sempre stato il mio nome preferito!;anger
E solo che … [non-verbal];italian;happiness; Eh solo che... beh!;happiness
Che splendida idea.;italian;happiness; Di splendida idea!;happiness
Ah questa casa! È questa casa che mi prende.;italian;happiness; Questa casa! È questa casa che mi prende!;happiness
Uno che lavora qui mi sembra un po' strano.;italian;happiness; uno che lavora qui mi sembra un po' strano.;disgust
Qui c'è qualcosa che mi ricorda la bambina che ero e che non mi ha mai abbandonata.;italian;happiness; Qui c'è qualcosa che mi ricorda la bambina che ero e che non mi ha mai abbandonata.;sadness
Di quei che parlavano in latino.;italian;happiness; Dicco anche parole in latino.;sadness
Non cominciare a vantarmi le meraviglie di quella schifezza. Io ti odiavo allora.;italian;happiness; Non cominciare a vantarmi le meraviglie di quella squinzietta. Io ti odiavo allora.;fear
Oh, credevo parlarsi del giudice.;italian;happiness; Credevo parlassi del giudice.;sadness
Avevo ragione.;italian;happiness; Avevo ragione!;anger
Grazie tante.;italian;happiness; Grazie tanto!;happiness
Avanti, calmati.;italian;happiness; Avanti, Calmatica.;happiness
Sei splendente come un panno illustrato.;italian;happiness; Sei splendente come un penne illustrato!;happiness
Credevo che fossi prestato ad un amore tempestoso.;italian;happiness; Credevo che fossi presa da un amore tempestoso!;anger
Mio Dio guarda, mi sono ricoperta.;italian;happiness; Mio Dio, guarda mi sono ricoperta, ricoperta!;anger
CioÈ, tutto qua.;italian;happiness; tutto qua.;disgust
No! [non-verbal] Sí! ;italian;happiness; no! sì!;anger
[non-verbal] bene.;italian;happiness; Be';fear
Stai arteggiando qualcosa.;italian;happiness; Stai architettando qualcosa?;disgust
È un fochettone da cucina.;italian;happiness; È un pochettone da cucina!;anger
Che cosa hai detto.;italian;happiness; Che cosa è questo?;fear
Solo le bimbettine con i boccoli d'oro.;italian;happiness; solo le bimbettine con il boccolino d'oro.;sadness
Buon compleanno!;italian;happiness; Buon compleanno!;happiness
Bastardo!;italian;anger; BASTARDO!;anger
Un dovere come questo Leonard non esiste.;italian;anger; Un dovere come questo, Leonard, non esiste.;sadness
Sono dovunque si prendono cura di me dei dottori che mi comunicano cosa è meglio nel mio interese.;italian;anger; Sono dovunque si prendono cura di me e dei dottori che mi comunicano cosa è meglio nel mio interesse.;fear
Io muoio se resto ancora qui.;italian;anger; Io muoio e sarò stancata qui!;anger
Dite così. No! questa è la mia!;italian;anger; Ti dico di no, questa è la mia!;anger
I giornalisti Inglesi stamattina si svegliano e pensano: ‘Io lo so dove si trova Anna Scott’.;italian;anger; I giornalisti inglesi stamattina si svegliano e pensano io lo so dove si trovano a scottare;fear
È in quela casa col portone blue a Notting Hill.;italian;anger; E in quella casa col portone blu a nothing hill;happiness
E poi te ne vai fori con quelle maledette mutande.;italian;anger; E fai dove hai fori con quelle maledette mutande!;anger
Santo Dio. Io ho un fidanzato.;italian;anger; Sant'Oghi, io io ho un fidanzato!;sadness
E ora da domani ci saranno foto di te su tutti i giornali da qui a Timbuktu.;italian;anger; E ora da domani ci saranno foto tue su tutti i giornali da qui a Timbuktu!;anger
Certo, per te una situazione perfetta, vero?;italian;anger; Certo, per te è una situazione perfetta, vero?;fear
Minimo imput massima pubblicità.;italian;anger; Minimo input, massima pubblicità!;anger
Dovunque andrai la gente dirà. Oh, complimenti a te, sei andato a letto con quell'attrice.;italian;anger; Dovunque andrai la gente dirà, oh, complimenti a te, sei andato a letto con quell'attrice.;happiness
Abbiamo visto le foto.;italian;anger; abbiamo visto le foto;sadness
Ti rendi conto ch’è la cosa più preziosa che possediamo.;italian;anger; Ti rendi conto che è la cosa più preziosa che possediamo?;fear
Io voglio saperlo adesso, quando diavolo vine casa. Adesso!;italian;anger; Io voglio saperlo adesso quando diavolo viene a casa! Adesso!;anger
Non provare a toccarla.;italian;anger; Non provare a toccarla!;anger
Corri qualche rischio. Fai qualche errore!;italian;anger; Corri qualche rischio, fai qualche errore!;anger
Per scoprire cosa è reale e cosa non lo è. Per scoprire quello che tu provi.;italian;anger; Per scoprire cosa è reale e cosa non lo è, per scoprire quello che tu provi!;anger
Niente box fuori casa. Capito.;italian;anger; Niente box fuori casa, capito?;disgust
Niente box. Punto e basta.;italian;anger; Niente box punta basta!;anger
Voi andate a scuola.;italian;anger; Voi andrete a scuola!;happiness
E andrete all'università e avrete una professione.;italian;anger; e andrete all'università e avrete una professione!;anger
Perché non vi farete sfondare il craneo anche voi.;italian;anger; Perché non vi farete sfondare il crani anche voi!;anger
Avete capito?;italian;anger; Avete capito?;anger
Sono stata chiara?;italian;anger; Sono stata Chiara!;anger
Fino ad ora.;italian;anger; fino ad ora.;disgust
Ma tirati fuori da quell incontro. Rompiti un'altra volta la mano se è necessario.;italian;anger; ma tirati fuori da quell'incontro! Rompiti un'altra volta la mano se necessario!;anger
Benché avessi paura io non ho detto niente.;italian;anger; Benché avessi paura io non ho detto niente!;anger
Ma io adesso ti dico che il tuo amico lì venderà la nostra chiave a qualche compare.;italian;anger; E adesso ti dico che il tuo amico lì venderà la nostra chiave a qualche compare;fear
Voglio vedere se questa volta ti comporti come se non te nefregasse un cazzo.;italian;anger; Voglio vedere se questa volta ti comparti come se non te ne fregasse un cazzo!;anger
Che non se ne sta lì a guardare mentre io vengo amonestata.;italian;anger; che non se ne sta lì a guardare mentre io vengo molestata!;fear
Non ha proprio senso che stai qui a fare questo tutto il giorno.;italian;anger; Non ha proprio senso che stai qui a fare questo tutto il giorno!;anger
Il caso è chiuso.;italian;anger; Il caso è chiuso!;happiness
I fotografi non ci sono più, i tuoi soci non ci sono più, ora non c'è più neanche la ricerca per il Dentrex.;italian;anger; I fotografi non ci sono più, i tuoi soci non ci sono più, ora non c'è più neanche la ricerca per il Dela Prex.;anger
È tutta colpa mia.;italian;sadness; È stata colpa mia.;disgust
Havrei potuto fermarlo.;italian;sadness; Avrei potuto fermarlo.;happiness
Si svegliava.;italian;sadness; Si svegliava.;sadness
E saltava giù dal latto.;italian;sadness; e saltava giù dal lato.;happiness
Se ne andava in giro.;italian;sadness; se ne andava ingeri.;sadness
Si svegliava.;italian;sadness; Sì, svegliava.;disgust
Ed era confuso.;italian;sadness; E era confuso.;disgust
[non-verbal] lo sono.;italian;sadness; Sì, lo so, no.;disgust
Voglio morire anche io.;italian;sadness; Valle morire anche;disgust
Io che credevo di essere incinta.;italian;sadness; E io che credo di essere intinta.;fear
Una caramella ce l’ha?;italian;sadness; Una caramella ce l'ha.;happiness
Mami ti manda milioni e milioni di baci.;italian;sadness; Mami ti manda milioni e milioni di baci.;sadness
Tranne l’unica cosa che volevo.;italian;sadness; l'unica cosa che volevo.;fear
Se mai sono preoccupata per Greg se è una cosa che se lui non c’è la fa.;italian;sadness; Se mai sono preoccupata per Riker, una cosa così linda non ce la fa!;anger
Al fatto che Katy é morta.;italian;sadness; al fatto che ti amore;happiness
Ai poveri Anabet e Jimmy ecco.;italian;sadness; Ai, poveriana, a Bettegimi, ecco!;happiness
Ho preso Michael ieri sera.;italian;sadness; ho preso mai con le ricette.;sadness
E sono andata in un Hotel.;italian;sadness; e sono andata in un mochile.;sadness
Non lo so Jimmy.;italian;sadness; non lo sorgiamo.;happiness
Mi dispiace davvero.;italian;sadness; Mi dispiace davvero.;sadness
Per le sofferenze terribili che vi ho procurato.;italian;sadness; per le sofferenze terribili che vi ho procurato.;disgust
Davvero mi dispiace davvero.;italian;sadness; Davvero, mi dispiace davvero.;sadness
Tutto mi dispiace.;italian;sadness; Anche a me dispiace;anger
Non sono mai stati aperti.;italian;sadness; non sono mai state aperti.;sadness
Non esiste niente.;italian;sadness; Non esiste niente.;disgust
Non cè nessuna cospirazione John.;italian;sadness; Non c'è nessuna cospirazione, già.;disgust
Non c’è nessun William Parker. ;italian;sadness; Non c'è nessun William Parcell.;sadness
Non è reale, è solo nella tua mente.;italian;sadness; Non è reale, è solo nella tua mente.;disgust
Sei malato.;italian;sadness; Sei malato!;happiness
Sei malato John.;italian;sadness; Sei malato, John.;happiness
Ha detto che se tu avessi detto questo …;italian;sadness; ha detto che se tu avessi detto questo.;sadness
Ha dei documenti per il ricovero coatto da farmi firmare.;italian;sadness; ha dei documenti per il ricovero 4 da farmi firmare.;happiness
Peró le mie, le mie figlie.;italian;sadness; Però le mie... le mie fine...;happiness
È così ingiusto per le babine [non-verbal];italian;sadness; così ingiusto per le bambine e diciamo;disgust
Comunque non ho …;italian;sadness; Comunque no.;disgust
Ma in parte molto di quello che scrivono su di me.;italian;sadness; Non mi importa molto di quello che scrivono su di me.;fear
Un’alta delusione.;italian;sadness; Un'altra diluzione.;disgust
Che se ne va.;italian;sadness; che c'è nemmeno;disgust
Fantastica, sì davvero fantastica.;italian;sadness; Fantastico, davvero fantastico!;happiness
C'erano questi monaci che cantavano.;italian;sadness; C'erano questi monaci che cantavano.;sadness
Ma non mi sono imozionata per niente.;italian;sadness; Ma non mi sono emozionata per niente.;disgust
Capisci?;italian;sadness; Capisce?;anger
Niente di più importante. Ti richiamo dopo. Va bene?;italian;sadness; Niente di importante, ti richiamo dopo, va bene?;disgust
Fiera di tutto ciò che faccio.;italian;sadness; Sì, fiamme, ti coloca fatta.;disgust
Uno ha cercato di aggredirmi ed io, le ho tirato un pugno e lui mi ha tagliato.;italian;fear; Uno ha cercato di accredirmi e io le ho tirato un pugno e lui mi ha tagliato.;anger
Io stavo andando verso la mia macchina.;italian;fear; io stavo andando verso la mia macchina;happiness
Io dico: Non fumo. Lui dice: Ne anch'io. E allora.;italian;fear; Io dico non fumo e lui dice neanche io e allora...;fear
Sento il cuore che si mette a dare mille perchè lì non c’è nessuno oltre a noi due.;italian;fear; Senta il cuore che si mette a darmi, perché lì non ce ne sono altre noi due.;anger
Ah il rapinatore, lo so come funziona il tuo cervello, lo so.;italian;fear; Ah, il rapinatore! Lo so come funziona il tuo cervello! Lo so!;happiness
Io torno a casa tutto insanguinato la notte che Katty viene uccisa.;italian;fear; Io torno a casa, tutto insanguinato, la stessa notte che Cati viene uccisa.;anger
E l’assassino sono io vero?;italian;fear; E l'assassino sono io, vero?;fear
Io non mi fido più ne anche della mia mente, devo avvertirti.;italian;fear; Io non mi fido più neanche della mia mente. Devo avvertirsi.;fear
Cazzo sta succedendo. Dove sono.;italian;fear; Ma che cazzo sta succedendo? Dove sono?;disgust
Dove diavolo siamo!;italian;fear; Ma dove diavolo siamo?;disgust
Non lo so.;italian;fear; Lo so! Sì!;happiness
Perché devo dirti il mio nome?;italian;fear; Perché devo dirti il mio nome?;fear
Che cosa ci faccio qui.;italian;fear; E cosa ci faccio qui?;anger
Non ricordo niente.;italian;fear; Non ricordo niente!;anger
Sono andato al letto nel mio appartamento e mi risveglio in questo posto di merda.;italian;fear; Sono andato a letto nel mio appartamento e mi risveglio in questo posto di merda!;happiness
Non voglio rischiare di romperlo. Lanciami la cassetta.;italian;fear; Non voglio rischiare di romperlo. Lanciami la cassetta!;anger
È solo solo un brutto scherzo, vero?;italian;fear; è solo un brutto scherzo vero?;anger
Chi è?!;italian;fear; Chi è?;fear
Chi sai?!;italian;fear; CHISSAL!;anger
Fatti vedere!;italian;fear; Fatti vedere!;anger
Ti ammazzo figlio di puttana!;italian;fear; Ti ammazzo figlio di puttana!;anger
Chi è che parla?;italian;fear; Chi è che parla?;fear
Piccola sono io. Ti sento.;italian;fear; Sì, piccola, sono io. Ti sento.;disgust
William io non pensavo di dover fare questo.;italian;fear; William, io non pensavo di dover fare questo.;sadness
... hai svolto un incarico top secret per il governo.;italian;fear; Alicio, ho svolto un incarico top secret per il governo.;fear
Esiste la minaccia di un disastro di proporzioni catastrofiche.;italian;fear; Esista la minaccia di un disastro di proporzioni catastrofiche.;fear
Con tutto il rispetto, questo è assolutamente ridicolo. Non ha alcun senso!;italian;fear; Con tutto il rispetto questo è assolutamente ridicolo, non ha alcun senso.;anger
Accendi la luce!;italian;fear; Accendi la luce!;anger
Che cos'è questa puzza tremenda.;italian;fear; Che cos'è questa fuccia tremenda?;fear
Ho bisogno di te.;italian;fear; Ho bisogno di te!;anger
Ne abbemo paura che fossi morto.;italian;fear; Avevo paura che fossi morto!;anger
Mi è successa la stessa cosa anche a me.;italian;fear; È successa la stessa cosa anche a me!;happiness
Sono stato colpito da scarice elettriche.;italian;fear; Sono stato colpito da scariche elettriche!;anger
Aiuto!;italian;fear; AIUTO!;anger
Qualcuno mi aiuti!;italian;fear; qualcuno mi aiuti!;anger
Sì, si chiama Sed.;italian;fear; Si, si chiama Z;happiness
Che stà succedendo.;italian;fear; Che sta succedendo?;disgust
Eh, solo solo il greletto.;italian;fear; solo il grilletto;happiness
Era un lupo mannaro.;italian;fear; E non lo pamanerò.;disgust
Io non ho ucciso Katty.;italian;fear; Io non ho ucciso, che ti...;disgust
Lei stava seduta sopra il letto, e …;italian;fear; Lei stava seduta a spruilletto!;anger
Dove sono, nei regno dei morti?;italian;fear; Sono nel regno dei morti!;fear
Chi è!;italian;fear; Ghièèèèèèèèèèèèèèèèèèèèèèèèèèèèèèèèèèèèèèèèèèèèèèèèèèèèèèèèèèèèèèèèèèèèèèèèèèèèèèèèèèèèèèèèèèèèèèèèèèèèèèèèèèèèèèèèèèèèèèèèèèèèèèèèèèèèèèèèèèèèèèèèèèèèèèèèèèèèèèèèèèèèèèèèèèèèèèèèèèèèèèèèèèèèèèèèèèèèèèèèèèèèèèèèèèèèèèèèèèèèèèèèèèèèèèèèèèèèèèèèèèèèèèèèèèèèèèèèèèèèèèèèèèèèèèèèèèèèèèèèèèèèèèèèèèèèèèèèèèèèèèèèèèèèèèèèèèèèèèèèèèèèèèèèèèèèèèèèèèèèèèèèèèèèèèèèèèèèèèèèèèèèèèèèèèèèèèèèèèèèèèèèèèèèèèèèèèèèèèèèèèèèèèèèèèèèèèèèèèèèèèèèèèèèèèèèèèèèèèèèèè;disgust
Gli ho parlato.;italian;fear; Chi ha parlato?;sadness
Come quando si dice: Non è una rivolta, è rabbia.;italian;disgust; Come quando si dice non è una rivolta, è rabbia!;anger
Gardate questa insignificante squallida cosa.;italian;disgust; Guardate questa insignificante squallida cosa.;anger
Qualquno sa dirme in che somiglia alla foto?;italian;disgust; Qualcuno sa dirmi in che somiglia la foto.;fear
Aspetta la vediamo.;italian;disgust; Aspetta, vediamo.;sadness
Quando ho compiuto sei anni il mio miglior amico di allora mi ha ferito con un chiodo arruginito.;italian;disgust; Quando ho compiuto sei anni, il mio migliore amico di allora mi ha ferito con un chiodo arrugginito.;fear
Davvero? Eppure lo sbirro pensa che ci sia tu dietro tutto questo.;italian;disgust; Davvero? Eppure lo sbirro pensa che ci sia tu dietro tutto questo.;fear
Perché ti arrabbi? Guarda che non me ne frega niente.;italian;disgust; Perché ti arrabbi? Guarda che non me ne frega niente!;anger
Lieto di esserle stato d'aiuto.;italian;disgust; Lieto di essere l'estate d'aiuto.;sadness
Ho un orario di ufficio fisso. Se ci sono ulteriori informazioni che lei habbia bisogno su detti o qualche proverbio.;italian;disgust; Ho un orario di ufficio fisso, se ci sono ulteriori informazioni che le abisognano su detti, qualche proverbio...;anger
La mia porta è apertissima.;italian;disgust; La mia porta è apertissima.;fear
Magari la prossima volta che va all'ospedale potrebbe portare anche noi.;italian;disgust; Magari la prossima volta che va all'ospedale potrebbe portare anche noi.;fear
Bene, nel prenderò nota. C'è altro che posso fare per lei?;italian;disgust; Bene, ne prenderò nota. C'è altro che posso fare per lei?;disgust
Non includermi ne ho abbastanza delle convocazioni.;italian;disgust; Non includermi, ne ho abbastanza delle convocazioni.;sadness
