transcription;language;emotion;model_transcription;model_emotion
For the first time in eighteen years I'm going to be able to call the shots in my own life. Oh my God!;english;happiness; For the first time in 18 years I'm going to be able to call the shots in my own life. Oh my god!;positive
Well, as often as they can.;english;happiness; Well, as often as they can.;neutral
Jesus H. Christ!;english;happiness; Jesus, say it's Christ.;neutral
Jesus, Mary and Joseph!;english;happiness; Jesus, Mary and Joseph!;positive
You know, I might as well get an Ahooga horn and chase him around the ring.;english;happiness; You know, I might as well get in the Oglehorn and chase him around the ring.;neutral
You think because of that, the audience won't recognize him as being a black man?;english;happiness; You think because of that, the audience won't recognize him as being a black man?;negative
Mr. Wheeler, you are magnificent.;english;happiness; Mr. Wheeler, you are magnificent.;positive
I get your logic. Demi-capu coming right up.;english;happiness; Gecologic, Demi Capu coming right up.;neutral
That's some of the best shit I've ever heard come out of your mouth.;english;happiness; That's one of the best shit I've ever heard come out of your mouth.;positive
Give the guy a break.;english;happiness; Give the guy a break.;negative
I don't know. The girls like it.;english;happiness; I don't know, the girls like it.;neutral
Is that any way to talk to a guest? A friend of the family?;english;happiness; Is that any way to talk to a guest, a friend of the family?;neutral
Fucking A. Back from the dead.;english;happiness; fucking A back from the dead.;negative
Fifty fucking pounds, man.;english;happiness; 50 fucking pounds, man.;negative
I'm telling you, man, this kid is awesome as hell.;english;happiness; I'm telling you, man, this kid is awesome as hell.;positive
I lost count, man.;english;happiness; I lost count, man.;negative
Doesn't matter, man.;english;happiness; Then matter, man.;neutral
Make that second most beautiful invention!;english;happiness; Make that second most beautiful invention.;positive
I'd feel a bit of a fool handing it over myself.;english;happiness; I feel a bit of a fool handing that over myself.;negative
[non-verbal] I just use it for clean-up.;english;happiness; I didn't, I just used it for the, for cleanup.;neutral
[non-verbal] I gotta go see about a girl.;english;happiness; I gotta go see about it, girl.;neutral
Everybody has their own idea of what they think paradise is. [non-verbal];english;happiness; Everybody has their own idea what they think paradise is.;neutral
The wife thinks it's paradise.;english;happiness; who I think is paradise.;neutral
So I shared that with you.;english;happiness; Sorry I shared that with you.;negative
And one night it was so loud it woke the dog up.;english;happiness; One night it was so loud it woke the dog up.;negative
Well, like I say, they make me ask. You understand.;english;happiness; Well, like I said, they make me ask, you understand.;neutral
A walk!;english;anger; I walk.;neutral
Is that all? Just a walk.;english;anger; Is that all? Just a walk?;neutral
You've tried to kill yourself twice.;english;anger; You've tried to kill yourself twice!;negative
It was done for you!;english;anger; It was done for you!;positive
It was done for your betterment!;english;anger; It was done for your betterment!;positive
It was done out of love!;english;anger; I was turned out of love!;neutral
And it fucking pisses me off!;english;anger; And he fucking pisses me off!;negative
Shut the fuck up!;english;anger; THE FUCK UP!;negative
This is my daughter I'm talking about!;english;anger; This is my daughter I'm talking about!;positive
Everybody shut up!;english;anger; Everybody shut up!;negative
Shut up!;english;anger; SHUT UP!;negative
Why the hell did you think I was there?;english;anger; Why the hell did you think I was there?;negative
Tell me, I'm asking: 'What is there to understand?';english;anger; Tell me, I'm asking, what is that to understand?;neutral
Why do you think he does that, Gerry? Do you have any fucking clue why?;english;anger; Why do you think he does that, Jerry? Do you have any fucking clue why?;negative
It's not about you, you mathematical dick!;english;anger; It's not about you, you mathematical dick!;negative
He is a good kid!;english;anger; He's a good kid.;positive
Did you hear me? Shut up!;english;anger; Did you hear me? Shut up!;negative
Now you either tell me what is really going on or I'll cut you with this, you hear me? I'll cut ...;english;anger; Now you either tell me what is really going on or I'll cut you with this, you hear me? I'll cut-;negative
Well then don't keep me in the dark about what you're thinking!;english;anger; Well then don't keep me in the dark about what you're thinking!;negative
Does that mean you saw what happened to me?;english;anger; Does that mean you saw what happened to me?;neutral
You goddamn well should!;english;anger; In god damn motion!;negative
Yes!;english;anger; Yes!;positive
I don't care if you love him!;english;anger; I don't care if you love him!;neutral
I'm telling you!;english;anger; I'm telling you!;positive
There's a bus full of dead people!;english;anger; There's a bus full of dead people!;negative
Who? Someone you know?;english;anger; Who? Someone you know?;neutral
No, you didn't tell me.;english;anger; No, you didn't tell me.;negative
I don't like you!;english;anger; I don't like you.;negative
Because you make my effort a joke!;english;anger; Because you make my effort a joke!;negative
I want to be a doctor! This isn't a game to me!;english;anger; I wanna be a doctor! This is a game to me!;neutral
This isn't playtime!;english;anger; This isn't playtime!;negative
This is serious business!;english;anger; This is serious business!;neutral
How hard can that be?;english;anger; How hard can that be?;negative
Fights being stopped by referees? He's pathetic!;english;anger; Fights me and stop my reveries? He's pathetic!;negative
What does that mean?;english;anger; What does that mean?;neutral
If she's not guilty, why am I?;english;anger; If she's not guilty, why am I?;negative
Makes you feel ...;english;sadness; Thanks for being here.;positive
... alian.;english;sadness; He'll eat it.;neutral
You know, after ...;english;sadness; You know, I have to...;neutral
... then I ever was of being in ...;english;sadness; Never was a been;neutral
I loved her.;english;sadness; I loved it.;positive
When we were sitting in that kitchen that night ...;english;sadness; when we were sitting in that kitchen at night.;neutral
I don't want it.;english;sadness; I'm wanted.;neutral
She had to go meet Eve and Diane.;english;sadness; We have to go meet Eve and Diane.;neutral
We were gonna leave Sunday.;english;sadness; I'm gonna leave Sunday.;neutral
We were gonna get married when we got there.;english;sadness; We were going to get married when we got there.;neutral
I loved her so much.;english;sadness; I love her so much.;positive
It doesn't happen twice.;english;sadness; It doesn't happen twice.;neutral
But now she wants to die.;english;sadness; But now she wants to die.;negative
And I swear to God, Father ...;english;sadness; And I swear to God, Father.;positive
It's comitting a sin by doing it.;english;sadness; It's committing a sin by doing it.;negative
By keeping her alive I'm killing her.;english;sadness; I'm keeping her alive, I'm killing her.;neutral
Do you know what I mean?;english;sadness; Don't obey.;negative
How do I get around that?;english;sadness; How do I get around that?;negative
Went to see Maggie this morning.;english;sadness; I went to see Manga this morning.;positive
You must have been somewhere else.;english;sadness; You must have been somewhere else.;negative
But maybe you won't sign them.;english;sadness; Maybe you want something;neutral
Maybe you'll just give me some time.;english;sadness; Maybe you'll just give me some time.;neutral
I will try to figure this out.;english;sadness; I will try to figure this out.;neutral
Whatever you do, Rosen is right about one thing.;english;sadness; Whatever you do, Rosen is right about one thing.;neutral
You shouldn't be here.;english;sadness; You shouldn't be here.;negative
I'm not safe anymore.;english;sadness; I'm not safe anymore.;negative
You have a gift.;english;sadness; You have a gift.;positive
You know, they like you.;english;sadness; You know, they like you.;neutral
And if you leave, I can't learn this way.;english;sadness; And if you leave, I can't learn this way.;negative
Couldn't help that one.;english;sadness; Couldn't help that one.;negative
And he can't stop thinking about Annie.;english;sadness; And he can't stop thinking about it.;neutral
Ever since then, things have been different.;english;sadness; Ever since then, things have been different.;neutral
He is not the same person that he used to be.;english;sadness; He's not the same person that he used to be.;negative
And his wife ... doesn't like the person that he's become.;english;sadness; And his wife doesn't like the person that he's become.;negative
And then one day Malcom meets this wonderful little boy.;english;sadness; And then one day Malcolm meets this wonderful little boy.;positive
And Malcom decides to try and help this new boy.;english;sadness; And Malcolm decides to try and help this new boy.;neutral
Cause he feels that ...;english;sadness; Because he feels that.;neutral
... it would be like ... helping that other one too.;english;sadness; be like helping that other one too.;neutral
You have to understand. When I was growing up, he was gone more than he was there.;english;sadness; You have to understand, when I was growing up, he was gone more than he was there.;neutral
Maybe he never wanted a family.;english;sadness; Maybe he never wanted a family.;negative
Whatever it is, he likes his second life ...;english;sadness; Whatever it is he likes his second life.;neutral
... better and the reason that he tells his stories is because he can't stand this boring place.;english;sadness; And the reason that he tells these stories is because he can't stand this boring place.;negative
What's true?;english;sadness; What's true?;neutral
